<?xml version="1.0"?>
<!DOCTYPE container SYSTEM "../admin/container.dtd">
<container>
   <name/>
   <tcp-server>
      <port/>
      <queue/>
      <min-handlers/>
      <max-handlers/>
      <max-keepalives/>
      <so-timeout/>
      <handler-timeout/>
      <allow-hosts/>
      <deny-hosts/>
   </tcp-server>
   <ssl-server>
      <port/>
      <queue/>
      <min-handlers/>
      <max-handlers/>
      <max-keepalives/>
      <so-timeout/>
      <handler-timeout/>
      <allow-hosts/>
      <deny-hosts/>
      <keystore>
         <location/>
         <password/>
      </keystore>
      <is-client-authentication-needed/>
      <trustedstore>
         <location/>
         <password/>
      </trustedstore>
   </ssl-server>
   <standalone/>
   <protocol-adapter/>
   <admin-ip/>
   <jsp>
      <refresh/>
      <compiler/>
   </jsp>
   <work-dir/>
   <logger>
      <level/>
      <location/>
      <config/>
   </logger>
   <default-web-config/>
   <manager>
      <port/>
      <auth-key/>
   </manager>
   <host>
      <id/>
      <doc-base/>
      <autoload/>
      <session-backup/>
      <access-log>
         <location/>
         <type/>
         <resolve/>
      </access-log>
      <context>
         <path/>
         <location/>
         <protocol/>
         <jsp-precompile/>
         <destroy-timeout/>
         <session-backup/>
         <jndi-link>
            <factory/>
            <lookup/>
            <parameter>
               <name/>
               <value/>
            </parameter>
         </jndi-link>
         <jta/>
         <jdbc-link>
            <description/>
            <name/>
            <url/>
            <driver/>
            <user/>
            <password/>
            <login-timeout/>
            <pool-size-limit/>
            <fill-pool/>
            <init-sql/>
            <transaction-timeout/>
            <isolation-level/>
         </jdbc-link>
      </context>
   </host>
</container>
